{
  "schema_version": "1.0",
  "selection_basis": "unresolved",
  "fonts": [],
  "environments": {
    "build": {"status": "unverified", "available_fonts": [], "evidence": []},
    "render": {"status": "unverified", "available_fonts": [], "evidence": []},
    "target": {"status": "unverified", "available_fonts": [], "evidence": []}
  }
}
